{"$schema":"https://json-schema.org/draft/2020-12/schema","$id":"https://github.com/organicoverlords/lowvram3d-studio/schemas/scene_spec_v1.schema.json","title":"LowVRAM3D SceneSpec v1","type":"object","additionalProperties":false,"required":["schema_version","scene_id","intent","source","coordinate_system","camera","regions","assets","pcg","budgets","proof"],"properties":{"schema_version":{"const":"scene_spec_v1"},"scene_id":{"type":"string","pattern":"^[a-z0-9][a-z0-9_-]{2,63}$"},"intent":{"type":"object","additionalProperties":false,"required":["mode","target_engine","deterministic_seed","quality_tier"],"properties":{"mode":{"enum":["source_locked_2p5d","hybrid_gameplay_scene","procedural_world","asset_population"]},"target_engine":{"const":"unreal_5_8"},"deterministic_seed":{"type":"integer","minimum":0,"maximum":2147483647},"quality_tier":{"enum":["smoke","preview","production"]},"description":{"type":"string"}}},"source":{"type":"object","additionalProperties":false,"required":["kind","sha256"],"properties":{"kind":{"enum":["image","video","text","captured_scene"]},"path":{"type":"string"},"sha256":{"type":"string","pattern":"^[a-f0-9]{64}$"},"dimensions_px":{"type":"array","prefixItems":[{"type":"integer","minimum":1},{"type":"integer","minimum":1}],"minItems":2,"maxItems":2},"frame_index":{"type":"integer","minimum":0},"notes":{"type":"string"}}},"coordinate_system":{"type":"object","additionalProperties":false,"required":["units","up_axis","handedness","unreal_scale_cm_per_unit"],"properties":{"units":{"enum":["meters"]},"up_axis":{"enum":["Z"]},"handedness":{"enum":["right"]},"unreal_scale_cm_per_unit":{"type":"number","exclusiveMinimum":0}}},"camera":{"type":"object","additionalProperties":false,"required":["source_camera","required_views"],"properties":{"source_camera":{"$ref":"#/$defs/cameraView"},"required_views":{"type":"array","minItems":1,"maxItems":16,"items":{"$ref":"#/$defs/cameraView"}},"envelope":{"type":"object","additionalProperties":false,"properties":{"max_translation_m":{"type":"number","minimum":0},"max_yaw_deg":{"type":"number","minimum":0,"maximum":180},"max_pitch_deg":{"type":"number","minimum":0,"maximum":90}}}}},"depth_bands":{"type":"array","items":{"$ref":"#/$defs/depthBand"}},"regions":{"type":"array","minItems":1,"items":{"$ref":"#/$defs/region"}},"landmarks":{"type":"array","items":{"$ref":"#/$defs/landmark"}},"splines":{"type":"array","items":{"$ref":"#/$defs/spline"}},"assets":{"type":"array","items":{"$ref":"#/$defs/asset"}},"populations":{"type":"array","items":{"$ref":"#/$defs/population"}},"pcg":{"type":"object","additionalProperties":false,"required":["policy","reference_graphs","layers"],"properties":{"policy":{"enum":["reference_driven_incremental"]},"reference_graphs":{"type":"array","items":{"type":"string"},"minItems":1},"layers":{"type":"array","items":{"$ref":"#/$defs/pcgLayer"}}}},"budgets":{"type":"object","additionalProperties":false,"required":["gpu_vram_mb","max_total_triangles","max_texture_memory_mb","max_gpu_population_instances"],"properties":{"gpu_vram_mb":{"type":"integer","minimum":256},"max_total_triangles":{"type":"integer","minimum":0},"max_texture_memory_mb":{"type":"integer","minimum":0},"max_gpu_population_instances":{"type":"integer","minimum":0},"max_draw_calls_target":{"type":"integer","minimum":0},"allow_concurrent_neural_and_unreal_gpu":{"const":false}}},"uncertainties":{"type":"array","items":{"$ref":"#/$defs/uncertainty"}},"proof":{"type":"object","additionalProperties":false,"required":["required_gates","current_classification"],"properties":{"required_gates":{"type":"array","minItems":1,"items":{"type":"string","pattern":"^[A-Z0-9_]+$"}},"current_classification":{"enum":["NOT_RUN","PARTIAL","PROVEN","REJECTED","BLOCKED"]},"evidence_root":{"type":"string"}}},"outputs":{"type":"object","additionalProperties":{"type":"string"}}},"$defs":{"vec2":{"type":"array","prefixItems":[{"type":"number"},{"type":"number"}],"minItems":2,"maxItems":2},"vec3":{"type":"array","prefixItems":[{"type":"number"},{"type":"number"},{"type":"number"}],"minItems":3,"maxItems":3},"transform":{"type":"object","additionalProperties":false,"required":["translation_m","rotation_deg_xyz","scale_xyz"],"properties":{"translation_m":{"$ref":"#/$defs/vec3"},"rotation_deg_xyz":{"$ref":"#/$defs/vec3"},"scale_xyz":{"$ref":"#/$defs/vec3"}}},"cameraView":{"type":"object","additionalProperties":false,"required":["id","projection","position_m","look_at_m","near_m","far_m"],"properties":{"id":{"type":"string"},"projection":{"enum":["perspective","orthographic"]},"field_of_view_deg":{"type":"number","exclusiveMinimum":0,"exclusiveMaximum":180},"ortho_scale_m":{"type":"number","exclusiveMinimum":0},"position_m":{"$ref":"#/$defs/vec3"},"look_at_m":{"$ref":"#/$defs/vec3"},"principal_point_norm":{"$ref":"#/$defs/vec2"},"near_m":{"type":"number","exclusiveMinimum":0},"far_m":{"type":"number","exclusiveMinimum":0},"purpose":{"enum":["source_match","offset_parallax","gameplay","qa"]}},"allOf":[{"if":{"properties":{"projection":{"const":"perspective"}}},"then":{"required":["field_of_view_deg"]}},{"if":{"properties":{"projection":{"const":"orthographic"}}},"then":{"required":["ortho_scale_m"]}}]},"depthBand":{"type":"object","additionalProperties":false,"required":["id","near_m","far_m"],"properties":{"id":{"type":"string"},"near_m":{"type":"number","minimum":0},"far_m":{"type":"number","exclusiveMinimum":0}}},"region":{"type":"object","additionalProperties":false,"required":["id","label","representation","confidence"],"properties":{"id":{"type":"string"},"label":{"type":"string"},"representation":{"enum":["visual_shell","editable_mesh","gameplay_proxy","procedural_population","sky"]},"depth_band":{"type":"string"},"bbox_norm_xyxy":{"type":"array","items":{"type":"number","minimum":0,"maximum":1},"minItems":4,"maxItems":4},"confidence":{"type":"number","minimum":0,"maximum":1},"tags":{"type":"array","items":{"type":"string"}},"walkable":{"type":"boolean"},"interactive":{"type":"boolean"}}},"landmark":{"type":"object","additionalProperties":false,"required":["id","role"],"properties":{"id":{"type":"string"},"role":{"enum":["camera_calibration","layout_anchor","interaction_anchor","qa_anchor"]},"source_uv_norm":{"$ref":"#/$defs/vec2"},"world_m":{"$ref":"#/$defs/vec3"},"tolerance_px":{"type":"number","minimum":0}}},"spline":{"type":"object","additionalProperties":false,"required":["id","kind","points_m","width_m"],"properties":{"id":{"type":"string"},"kind":{"enum":["road","river","path","wall","fence","bridge_axis"]},"points_m":{"type":"array","minItems":2,"items":{"$ref":"#/$defs/vec3"}},"width_m":{"type":"number","exclusiveMinimum":0},"exclusion_radius_m":{"type":"number","minimum":0},"grammar_id":{"type":"string"},"tags":{"type":"array","items":{"type":"string"}}}},"asset":{"type":"object","additionalProperties":false,"required":["id","semantic_class","representation","transform","collision","navigation","lod_policy"],"properties":{"id":{"type":"string"},"semantic_class":{"type":"string"},"representation":{"enum":["visual_shell","editable_mesh","gameplay_proxy","procedural_module"]},"source_uri":{"type":"string"},"transform":{"$ref":"#/$defs/transform"},"collision":{"enum":["none","simple","complex_as_simple","custom_proxy"]},"navigation":{"enum":["ignored","obstacle","walkable"]},"lod_policy":{"enum":["none","nanite","generated_lods","proxy_hlod"]},"material_policy":{"enum":["source_pbr","unlit_projection","engine_material","vertex_color"]},"triangle_budget":{"type":"integer","minimum":0},"region_id":{"type":"string"},"tags":{"type":"array","items":{"type":"string"}}}},"population":{"type":"object","additionalProperties":false,"required":["id","region_id","asset_refs","execution","density_per_m2","min_distance_m"],"properties":{"id":{"type":"string"},"region_id":{"type":"string"},"asset_refs":{"type":"array","minItems":1,"items":{"type":"string"}},"execution":{"enum":["cpu_pcg","gpu_pcg","baked_instances"]},"density_per_m2":{"type":"number","minimum":0},"min_distance_m":{"type":"number","minimum":0},"grid_size_m":{"type":"number","exclusiveMinimum":0},"runtime_generation":{"type":"boolean"},"exclusion_tags":{"type":"array","items":{"type":"string"}},"requires_collision":{"type":"boolean"},"requires_navigation":{"type":"boolean"}}},"pcgLayer":{"type":"object","additionalProperties":false,"required":["id","pattern","execution","grid_size_m","inputs","outputs"],"properties":{"id":{"type":"string"},"pattern":{"enum":["large_objects","small_scatter","spline_modules","intersection_modules","exclusion_mask"]},"execution":{"enum":["cpu","gpu"]},"grid_size_m":{"type":"number","exclusiveMinimum":0},"inputs":{"type":"array","items":{"type":"string"}},"outputs":{"type":"array","items":{"type":"string"}},"reference_graph":{"type":"string"}}},"uncertainty":{"type":"object","additionalProperties":false,"required":["id","description","severity","fallback"],"properties":{"id":{"type":"string"},"description":{"type":"string"},"severity":{"enum":["low","medium","high"]},"fallback":{"type":"string"}}}}}