{"schema_version":"scene_spec_v1","scene_id":"castlegrounds_hybrid_v1","intent":{"mode":"hybrid_gameplay_scene","target_engine":"unreal_5_8","deterministic_seed":20260803,"quality_tier":"smoke","description":"Preserve the source camera with a 2.5D visual shell, then add bounded editable and gameplay layers."},"source":{"kind":"image","path":"C:\\Users\\Lauri\\Downloads\\benchmarkpics\\castlegrounds.png","sha256":"e8ea9e307327169d998df9fd6757db718e5647ac46fc8235f971416e132df6ba","dimensions_px":[1448,1086]},"coordinate_system":{"units":"meters","up_axis":"Z","handedness":"right","unreal_scale_cm_per_unit":100},"camera":{"source_camera":{"id":"source","projection":"perspective","field_of_view_deg":48.0,"position_m":[0.0,-110.0,18.0],"look_at_m":[0.0,38.0,12.0],"principal_point_norm":[0.5,0.5],"near_m":0.1,"far_m":500.0,"purpose":"source_match"},"required_views":[{"id":"source","projection":"perspective","field_of_view_deg":48.0,"position_m":[0.0,-110.0,18.0],"look_at_m":[0.0,38.0,12.0],"principal_point_norm":[0.5,0.5],"near_m":0.1,"far_m":500.0,"purpose":"source_match"},{"id":"offset_left","projection":"perspective","field_of_view_deg":48.0,"position_m":[-1.0,-110.0,18.0],"look_at_m":[0.0,38.0,12.0],"principal_point_norm":[0.5,0.5],"near_m":0.1,"far_m":500.0,"purpose":"offset_parallax"},{"id":"offset_right","projection":"perspective","field_of_view_deg":48.0,"position_m":[1.0,-110.0,18.0],"look_at_m":[0.0,38.0,12.0],"principal_point_norm":[0.5,0.5],"near_m":0.1,"far_m":500.0,"purpose":"offset_parallax"}],"envelope":{"max_translation_m":2.0,"max_yaw_deg":5.0,"max_pitch_deg":3.0}},"depth_bands":[{"id":"foreground","near_m":0.1,"far_m":20.0},{"id":"castle","near_m":20.0,"far_m":38.0},{"id":"water","near_m":38.0,"far_m":58.0},{"id":"background","near_m":58.0,"far_m":100.0}],"regions":[{"id":"source_shell","label":"source-visible reconstructed surface","representation":"visual_shell","depth_band":"foreground","confidence":0.99,"tags":["source_locked"],"walkable":false,"interactive":false},{"id":"castle_core","label":"castle and lighthouse gameplay area","representation":"editable_mesh","depth_band":"castle","bbox_norm_xyxy":[0.38,0.18,0.72,0.72],"confidence":0.72,"tags":["hero_structure"],"walkable":true,"interactive":true},{"id":"water_channels","label":"water channels","representation":"gameplay_proxy","depth_band":"water","confidence":0.68,"tags":["water","exclusion"],"walkable":false,"interactive":false},{"id":"vegetation","label":"decorative vegetation","representation":"procedural_population","depth_band":"foreground","confidence":0.55,"tags":["decorative"],"walkable":false,"interactive":false},{"id":"sky","label":"sky and clouds","representation":"sky","confidence":0.95,"tags":["background"],"walkable":false,"interactive":false}],"landmarks":[{"id":"lighthouse_top","role":"camera_calibration","source_uv_norm":[0.58,0.19],"world_m":[12.0,25.0,49.0],"tolerance_px":38.0},{"id":"castle_base","role":"layout_anchor","world_m":[10.0,28.0,5.0]},{"id":"foreground_cliff","role":"qa_anchor","world_m":[-22.0,31.0,16.0]}],"splines":[{"id":"river_main","kind":"river","points_m":[[-30.0,45.0,0.0],[0.0,50.0,0.0],[30.0,58.0,0.0]],"width_m":12.0,"exclusion_radius_m":3.0,"tags":["water","no_build"]},{"id":"bridge_axis_main","kind":"bridge_axis","points_m":[[-10.0,31.0,4.0],[10.0,31.0,4.0]],"width_m":3.0,"grammar_id":"bridge_tile_v1","tags":["crossing"]}],"assets":[{"id":"source_mesh_v2","semantic_class":"source_visible_shell","representation":"visual_shell","source_uri":"C:\\AI\\ScenePipelineSmoke\\20260803\\castlegrounds\\castlegrounds_source_mesh_v2.glb","transform":{"translation_m":[0,0,0],"rotation_deg_xyz":[0,0,0],"scale_xyz":[1,1,1]},"collision":"none","navigation":"ignored","lod_policy":"nanite","material_policy":"unlit_projection","triangle_budget":374959,"region_id":"source_shell","tags":["proven_import","source_camera_locked"]},{"id":"castle_proxy","semantic_class":"castle","representation":"gameplay_proxy","transform":{"translation_m":[10,28,4],"rotation_deg_xyz":[0,0,0],"scale_xyz":[1,1,1]},"collision":"custom_proxy","navigation":"walkable","lod_policy":"generated_lods","material_policy":"engine_material","triangle_budget":50000,"region_id":"castle_core","tags":["replaceable","gameplay"]},{"id":"bridge_tile","semantic_class":"bridge_module","representation":"procedural_module","transform":{"translation_m":[0,0,0],"rotation_deg_xyz":[0,0,0],"scale_xyz":[1,1,1]},"collision":"simple","navigation":"walkable","lod_policy":"generated_lods","material_policy":"engine_material","triangle_budget":5000,"region_id":"castle_core","tags":["shape_grammar","gameplay"]},{"id":"grass_cluster","semantic_class":"grass","representation":"procedural_module","transform":{"translation_m":[0,0,0],"rotation_deg_xyz":[0,0,0],"scale_xyz":[1,1,1]},"collision":"none","navigation":"ignored","lod_policy":"none","material_policy":"engine_material","triangle_budget":48,"region_id":"vegetation","tags":["decorative","gpu_safe"]}],"populations":[{"id":"grass_population","region_id":"vegetation","asset_refs":["grass_cluster"],"execution":"gpu_pcg","density_per_m2":1.5,"min_distance_m":0.25,"grid_size_m":16.0,"runtime_generation":true,"exclusion_tags":["water","road","hero_structure"],"requires_collision":false,"requires_navigation":false}],"pcg":{"policy":"reference_driven_incremental","reference_graphs":["Engine/Plugins/PCG/SampleContent","Project/PCG/Reference/LargeObjects","Project/PCG/Reference/SmallScatter","Project/PCG/Reference/SplineModules"],"layers":[{"id":"exclusions","pattern":"exclusion_mask","execution":"cpu","grid_size_m":64.0,"inputs":["river_main","castle_core"],"outputs":["buildable_mask"],"reference_graph":"Project/PCG/Reference/ExclusionMask"},{"id":"bridges","pattern":"spline_modules","execution":"cpu","grid_size_m":64.0,"inputs":["bridge_axis_main","bridge_tile"],"outputs":["bridge_instances"],"reference_graph":"Project/PCG/Reference/SplineModules"},{"id":"large_objects","pattern":"large_objects","execution":"cpu","grid_size_m":128.0,"inputs":["buildable_mask","castle_proxy"],"outputs":["gameplay_geometry"],"reference_graph":"Project/PCG/Reference/LargeObjects"},{"id":"small_scatter","pattern":"small_scatter","execution":"gpu","grid_size_m":16.0,"inputs":["buildable_mask","grass_population"],"outputs":["decorative_instances"],"reference_graph":"Project/PCG/Reference/SmallScatter"}]},"budgets":{"gpu_vram_mb":6144,"max_total_triangles":1500000,"max_texture_memory_mb":1536,"max_gpu_population_instances":250000,"max_draw_calls_target":2500,"allow_concurrent_neural_and_unreal_gpu":false},"uncertainties":[{"id":"unseen_architecture","description":"Back sides of castle architecture are not observed in the source image.","severity":"high","fallback":"Use simple gameplay proxy geometry outside the source camera envelope."},{"id":"vegetation_identity","description":"Individual vegetation species and placement are not recoverable reliably.","severity":"medium","fallback":"Use biome-matched procedural populations with deterministic seed."},{"id":"unreal_render_capture","description":"Deterministic Unreal PNG capture is blocked in the current null-RHI execution path.","severity":"high","fallback":"Require a live editor or render-capable commandlet before promotion."}],"proof":{"required_gates":["SCENE_SPEC_VALID","SOURCE_CAMERA_COVERAGE_PROVEN","UNREAL_INTERCHANGE_IMPORT_PROVEN","UNREAL_SAVE_RELOAD_PROVEN","PCG_REFERENCE_GRAPH_PROVEN","COLLISION_NAV_PROVEN","UNREAL_SOURCE_RENDER_PROVEN","UNREAL_PARALLAX_PROVEN"],"current_classification":"PARTIAL","evidence_root":"proof/scene/20260803-image-to-scene-smoke/"},"outputs":{"source_shell_glb":"C:\\AI\\ScenePipelineSmoke\\20260803\\castlegrounds\\castlegrounds_source_mesh_v2.glb","unreal_asset_root":"/Game/AgentProof/ImageToSceneSmoke_20260803/","unreal_map":"/Game/AgentProof/ImageToSceneSmoke_20260803/Maps/Castlegrounds"}}